{
  "firm": "",
  "streetAddress": "2 MASSACHUSETTS AVE NE",
  "streetAddressAbbreviation": "",
  "secondaryAddress": "",
  "city": "WASHINGTON",
  "cityAbbreviation": "",
  "state": "DC",
  "postalCode": "",
  "province": "",
  "ZIPCode": "20212",
  "ZIPPlus4": "0001",
  "urbanization": "",
  "classificationCode": "D",
  "DPVConfirmation": "Y",
  "DPVCMRA": "N",
  "DPVFootnotes": "AABB"
}